{ "$schema": "http://json-schema.org/draft-07/schema#", "title": "Weaver CCI Submission", "type": "object", "required": [ "work_id", "title", "creator", "timestamps", "signals" ], "properties": { "work_id": { "type": "string" }, "title": { "type": "string" }, "creator": { "type": "object", "required": ["name"], "properties": { "name": { "type": "string" }, "contact": { "type": "string" } } }, "timestamps": { "type": "object", "required": ["started_at", "finalized_at"], "properties": { "started_at": { "type": "string", "format": "date-time" }, "finalized_at": { "type": "string", "format": "date-time" } } }, "signals": { "type": "object", "description": "Normalized 0â€“1 signals (0=none, 1=strong)", "required": [ "human_conception", "human_curation", "ai_generation", "ai_structure", "ai_voice_emulation" ], "properties": { "human_conception": { "type": "number", "minimum": 0, "maximum": 1 }, "human_curation": { "type": "number", "minimum": 0, "maximum": 1 }, "ai_generation": { "type": "number", "minimum": 0, "maximum": 1 }, "ai_structure": { "type": "number", "minimum": 0, "maximum": 1 }, "ai_voice_emulation": { "type": "number", "minimum": 0, "maximum": 1 } } }, "provenance": { "type": "object", "properties": { "tools": { "type": "array", "items": { "type": "string" } }, "commit_log_hash": { "type": "string" } } } } }