{"work_id": "work-001","title": "Example Work","creator": { "name": "John Weaver", "contact": "john@example.com" },"timestamps": { "started_at": "2025-09-01T12:00:00Z", "finalized_at": "2025-09-15T17:30:00Z" },"signals": {"human_conception": 0.9,"human_curation": 0.7,"ai_generation": 0.3,"ai_structure": 0.2,"ai_voice_emulation": 0.1},"provenance": { "tools": ["editor:word", "model:gpt"], "commit_log_hash": "abc123" }}